position,company,location,department,employment_type,salary_range,job_description_raw,job_link
Business Analyst,"Arise by INFINITAS Co., Ltd.","Bangkok, Thailand (Hybrid)",Business/Systems Analysts (Information & Communication Technology),Full time,Not specified,"Responsibilities :Act as subject matter expert in different areas of banking domain (e.g., Insurance, Payment, Lending, etc) to provide in-depth knowledge to other teams​​Collaborate with business stakeholders to identify and define functional requirements for delivering the necessary technology service to business​, while supporting delivery manager in aspects related to business domains during delivery​Perform requirement analysis, translate business requirements into detailed user stories and design specifications that are used to communicate with solutions architect and engineers​​Work with Solution Architect to create high-level design of E2E solution, ensuring that business requirements are aligned to technical design ​Identify potential issues, risks, dependencies and benefits of each solution​ Qualifications :Bachelor’s degree in Business Administration, Information Technology, Computer Science or related field ​Experience in writing user stories that meet all business needs and functional requirements​Ability to prioritize workload and execute tasks accordingly and in line with industry best practices​Understanding the latest software and hardware engineering principles and practices, such as methods and challenges of integration Benefits :Hybrid Working ArrangementWorld-Class Development ProgramPerformance BonusVacation Leave 15 Days + Maternity LeaveMacBook ProvidedHousing LoanLife Insurance/ Health Insurance/ Dental CareFitness Package Discounts (Corporate rate and privilege)Opportunity to be a part of team that drives Thailand Digital Economy (The contributor of the great impact to millions of Thai people through digital platforms e.g. PaoTang App. and Krungthai Next App) Working Location :The ParQ ชั้น 5, 9-10ติดกับ MRT สถานีศูนย์การประชุมแห่งชาติสิริกิติ์ ทางออกที่ 2Hybrid Work",https://ph.jobstreet.com/job/81182156?type=standard&ref=search-standalone#sol=53ad6870e7abe189824fddc4f5405ef03846259a
Data Engineer,FrieslandCampina (Thailand) PCL.,"Bang Phli, Samut Prakan, Thailand",Database Development & Administration (Information & Communication Technology),Full time,Not specified,"Purpose of JobTo build and maintain data infrastructure that connects production, quality, utility, and inventory data, enabling real-time visibility, decision-making, and efficiency improvements at the plant. Key Responsibilities ·       Design, build, and maintain data pipelines to collect data from PLCs, SCADA, sensors, ERP (e.g. SAP), lab instruments, and Excel/manual inputs.·       Clean, transform, and organize data into structured databases or data warehouses (SQL, Azure, etc.).·       Collaborate with Production, QA, Maintenance, and Planning teams to understand and translate operational needs into technical solutions.·       Support the development of dashboards (e.g. Power BI, Tableau) to visualize OEE, utility consumption, production loss, and quality KPIs.·       Ensure data quality, reliability, and real-time availability.·       Automate manual data entry and reporting tasks.·       Explore opportunities for predictive maintenance and AI/ML in process optimization. Qualification·       Bachelor’s degree in Computer Science, Engineering, Data Science, or related field.·       Experience in manufacturing or industrial settings preferred.·       Proficiency in: SQL, Python, or similar languages·       Data integration tools (e.g., Apache Airflow, Talend)·       Industrial data protocols (OPC-UA, Modbus, MQTT) – preferred·       Visualization tools (Power BI, Grafana, etc.)·       Understanding of manufacturing KPIs such as OEE, yield, CIP performance, and energy usage.·       Strong problem-solving and communication skills.",https://ph.jobstreet.com/job/86097123?type=standard&ref=search-standalone#sol=0ada10a3773aa3a64c92eff15f63837b493ddcd7
Data Analyst Consult,Tech Soft Holding Company Limited,"Bangkok, Thailand",Business/Systems Analysts (Information & Communication Technology),Full time,"฿45,000 – ฿60,000 per month (THB)",Job Data Analyst •เก็บรวบรวมและวิเคราะห์ข้อมูลที่ส่งผลกระทบต่อองค์กร จากหลายแหล่ง ทั้งภายในและภายนอก รวมถึง เหตุการณ์ที่เกิดขึ้นอันอาจจะกระทบความเป็นอยู่ของพนักงาน •ออกแบบและทำการทดสอบวิธีใช้งานข้อมูลและเทคนิคการวิเคราะห์ใหม่ๆ เพื่อนำเสนอมุมมองทางธุรกิจใหม่ๆให้แก่ผู้ที่เกี่ยวข้อง •จัดทำรายงานสรุปข้อมูลที่เข้าใจง่าย และสร้าง Dashboard ให้ผู้บริหารและส่วนงานที่ต้องการใช้งาน •นำเสนอผลการวิเคราะห์เพื่อประกอบการตัดสินใจเชิงกลยุทธ์ •การสร้าง ดูแล และ อัปเดตฐานข้อมูล และการประมวลผลข้อมูล •งานอื่นๆที่เกี่ยวข้องเพื่อสนับสนุนการทำงานของทีมวิเคราะห์ข้อมูล •Tableau Dashboard Design•Tableau Dashboard Develop,https://ph.jobstreet.com/job/85745452?type=standard&ref=search-standalone#sol=69c6080c9968e09a9e4b08389e1f6b66f6585648
เจ้าหน้าที่ NCB Data,"Kasikorn Leasing Co., Ltd.","Bangkok Metropolitan Region, Thailand (Hybrid)",Analysis & Reporting (Banking & Financial Services),Full time,Not specified,"ควบคุมการนำส่งข้อมูลเครดิต และคุณภาพของข้อมูลเครดิตของลูกค้าให้มีความสอดคล้องกับนโยบาย และข้อกำหนดของหน่วยงานทางการที่เกี่ยวข้องควบคุมการนำส่งหนังสือให้ความยินยอมเปิดเผยข้อมูล (NCB Consent)  ไปที่ บริษัทข้อมูลเครดิตแห่งชาติ (NCB)  ได้ถูกต้องและได้ตาม SLA ที่กำหนด   โดยจัดการข้อมูลเพื่อใช้ในการติดตามหนังสือให้ความยินยอม  รวมถึงสรุป  ตัวเลขปัญหาการติดตามหนังสือให้ความยินยอมเพื่อเสนอผู้บริหารติดต่อและประสานงานต่างๆ ระหว่างหน่วยงานในบริษัทฯ และบริษัทข้อมูลเครดิตแห่งชาติ จำกัดร่วมกับผู้บริหารในการพัฒนาระบบการนำส่งข้อมูลให้เป็นระบบและเป็นมาตฐานตามที่ NCB กำหนดรับผิดชอบในการตรวจสอบและ Upload Date ข้อมูลความเสี่ยงเพื่อนำเข้าระบบMonitor ระบบ Date leak Prevention (DLP) และบริหารจัดการ Incident ที่เกิดขึ้นInvestigate Case ที่เกิดขึ้น โดยร่วมกับ DLP Coordinator ในการกำหนดแนวทางจัดการคุณสมบัติวุฒิการศึกษาปริญญาโท/ตรี ด้านสถิติ,เศรษฐศาสตร์,การเงิน หรือสาขาอื่นๆที่เกี่ยวข้องมีประสบการณ์ในงานบริหารจัดการข้อมูล NCB อย่างน้อย 3 ปีมีประสบการณ์งานระบบสารสนเทศเพื่อการบริหาร (MIS)อย่างน้อย 3 ปีมีความรู้พื้นฐานในด้านการเงินการธนาคาร และมีทักษะในการจัดการปริมาณข้อมูลจำนวนมากได้เป็นอย่างดีมีทักษะการใช้โปรแกรม Microsoft Access, Excel, Power Point เป็นอย่างดีสามารถทำงานภายใต้ความกดดันได้อย่างดีสถานที่ปฏิบัติงานอาคารธนาคารกสิกรไทย สำนักงานใหญ่ พหลโยธิน - BTS Ari หมายเหตุ: ตำแหน่งงานนี้จำเป็นต้องตรวจสอบประวัติอาชญากรรมของบุคคลก่อนพิจารณารับเข้าทำงาน เพื่อความปลอดภัยและรักษามาตรฐานขององค์กร",https://ph.jobstreet.com/job/85265541?type=standard&ref=search-standalone#sol=036dae6f8e6c295cd750c9bae3d9b44d743e3d08
Data analyst (Social Listening),Plan B Media Public Company Limited,"Bangkok, Thailand",Business/Systems Analysts (Information & Communication Technology),Full time,Not specified,"Job PurposeMonitor and analyze real-time social data to protect and elevate brand reputation, guide strategy, and flag risks before they escalate.Job DescriptionTrack sentiment across social platforms and forums using listening tools.Benchmark competitors to spot trends, threats, and market gaps.Deliver weekly dashboards and summaries for key stakeholders.Alert PR teams of crises within 30 minutes and suggest response plans.Refine content strategy using insights and manage listening frameworks.Qualifications1–2 years of experience in social listening or digital analytics.Skilled in Excel and BI tools like Power BI or Tableau.Fluent in Thai with strong English reading/writing skills.Strong data storytelling and ability to identify key insights.Detail-driven, curious, and passionate about brand reputation.",https://ph.jobstreet.com/job/85862426?type=standard&ref=search-standalone#sol=8bf191ff404590a8de2e6a59cd0873ff41b27e64
Senior Marketing Analyst,Ocean Glass Public Company Limited,"Vadhana, Bangkok, Thailand",Market Research & Analysis (Marketing & Communications),Full time,Not specified,"ResponsibleCrafting, analyzing, and updating sales and marketing data such as product portfolio, new product performance, customer surveys, questionnaires, and online pollsMeasuring the effectiveness of marketing campaigns, new product launches, and strategiesAnalyzing data related to brand as well as product or serviceGathering data about consumers, competitors, and market conditionsMonitoring and forecasting marketing and sales trends in an industryConverting complex data into understandable graphs, tables, and written reportsWorking with research agency for a proper brand health check and market studyWorking with IT department to design dashboards for monitoring and analyzing sales and marketing dataPreparing reports and presenting to cross functional and management teamQualificationBachelor's degree in marketing, business, data science, or a related field with at least 3-5 years in marketing analytical experienceData analysis & interpretation including proficiency with tools like Excel, SQL, or etc.Understanding of marketing principles, strategies, and different channelsExcellent communication and presentation both in Thai and EnglishStrategic thinking to deliver analytical insights Effective project managementMultitasking with can do attitude and attention to details What we offerAt Ocean Glass, we are committed to supporting the professional and personal growth of our employees. In addition to a competitive salary, you will enjoy access to a range of benefits including:Annual BonusProvident FundCost of living allowance 1,100 Baht/MonthMeals allowance 60 Baht/DayAttendance allowance 500 Baht/MonthGroup InsuranceEmployee discount for Ocean glass Product : 50% off.Working day Monday to FridayFixed Working HoursAnnual leave: start from 7-17 days and other thingsWe pride ourselves on our collaborative and inclusive company culture, and we encourage applications from candidates with diverse backgrounds and experiences. About usEstablished in 1979, Ocean Glass Public Company Limited manufactures quality glassware for families, food service operators and companies or brands that would like to personalize their own glassware as gifts or souvenirs.Our vision is to be a world class market leader through business innovation, corporate values and operational excellence, while consistently maintaining customer satisfaction and achieving business growth and profitability.",https://ph.jobstreet.com/job/85864859?type=standard&ref=search-standalone#sol=322a0e8b7d1d3b565849dd522a111ce43f9bd7bf
Data Analyst,WHITELINE ACTIVATION COMPANY LIMITED,"Ratchathewi, Bangkok, Thailand",Business/Systems Analysts (Information & Communication Technology),Full time,Not specified,"Who are we?Whiteline Group is a dynamic organization at the forefront of innovation and growth. We provide end-to-end marketing solutions. Our business covers brand activation, retail media, retail execution, publishing, business consultancy and technology solutions. With a team of more than 300 talented and dedicated staff, our organization has grown quickly. As part of our journey, we are preparing for an Initial Public Offering (IPO). Now we are seeking new talent partners for growing together.How will you make an impact?You will turn raw data into real stories, shaping decisions across the company with dashboards people actually want to use, mentoring younger teammates, and finding smart ways to make numbers speak clearlyWhat you will do?Dig into data to spot patterns, trends, and cool surprises worth acting onTurn complex info into clear, useful insights anyone can getBuild and improve Power BI dashboards that actually help peopleMake sure reports are smooth, fast, and easy to readTeam up with others to figure out what they need from dataHelp define KPIs and track progress that really mattersMake sure data is clean, correct, and easy to understandShare tips and support teammates to grow their data skillsRun Power BI sessions to help others get confident with the toolKeep up with what’s new in Power BI and bring those ideas to the teamWhat you will need?Bachelor’s degree in data science, computer science, information systems or something similarAround 4–5 years working with data, or you’ve led analytics projects or mentored othersSuper comfortable with Power BI, including DAX, custom visuals, and setting up reportsKnow your way around SQL for getting and shaping dataBonus if you've tried other BI tools like Tableau, Looker, or QlikSome Python or R experience is a plusCan explain complex stuff in a way people actually getThink ahead and connect data work with the big pictureWhat will you get?Flexible working hoursSnack bar and ice creamMassage serviceCars & Motorcycle parking allowance (50% support by the company)Medical allowance and Dental allowance  Annual health checkMental health serviceAnnual salary adjustment & bonus (based on performance)Company outingAnnual leave days (up to 15 days)Special leave day (marriage, anniversary)Work Location: Thanapoom Tower Near BTS Nana, MRT Petchaburi.Dare to cross the Whiteline!",https://ph.jobstreet.com/job/85741021?type=standard&ref=search-standalone#sol=2c3f43a23a03263842fa07a814f9b3550e2e16d2
