position,company,location,department,employment_type,salary_range,job_description_raw,job_link
Sales Data Analyst (ecommerce USA business),Private Advertiser,"Khlong San, Bangkok, Thailand",Analysis & Reporting (Sales),Full time,Not specified,"Job DescriptionWe are looking for a skilled Data Analyst to calculate our Sales and Marketing (ad spend data). You need to have minimum 4 years of work expereince in this field. Your job duties include:-Calculate daily sales and segerate the data into various product groups as requiredDo Weekly/Monthly/Yearly sales comparision of data in excelCalculate daily Ad spend and segertate the data into various product groupsDo weekly/monthly/yearly ad spend comparisionCompile reports in Excel and present the data as requiredOther similar data analysis workMain Job skills Required:-Minimum 4 year experience. We are looking for Senior position onlyMust be very good with Math and NumbersMust be very good in Excel functions (all work will be done in Excel only)Must be detail oriented and responsibleDetail Oriented and ResponsibleThis is a full time job. We are looking for hard working ambitious people to grow with us. If you have the right skill set, you will be given the ability to take new initiatives and projects.",https://ph.jobstreet.com/job/86090791?type=standard&ref=search-standalone#sol=9a72aab40022031ceb6c3ec16f0e729b3c2f3a60
Data Analytic and BI Report,Krungthai Card Public Company Limited,"Vadhana, Bangkok, Thailand",Business/Systems Analysts (Information & Communication Technology),Full time,Not specified,"จัดทำข้อมูล เพื่อสนับสนุนงานด้าน Marketing Campaignนำเสนอผลการวิเคราะห์ และข้อมูลเชิงลึกให้กับผู้บริหาร และหน่วยงานอื่น ๆ เพื่อสนับสนุนการตัดสินใจทางธุรกิจสร้าง และพัฒนารายงาน BI ที่ซับซ้อน และมีความละเอียดสูง เพื่อสนับสนุนการตัดสินใจของผู้บริหาร และหน่วยงานอื่น ๆให้คำปรึกษา และอบรมทีมทำงานร่วมกับแผนกอื่น เพื่อให้การวิเคราะห์ และการนำเสนอข้อมูลเชื่อถือได้ และเหมาะสมต่อความต้องการของธุรกิจQualificationsการศึกษาระดับปริญญาตรีขึ้นไป สาขาวิทยาการคอมพิวเตอร์, เทคโนโลยีสารสนเทศ, สถิติประยุกต์, วิศวกรข้อมูล, เศรษศาสตร์ และสาขาอื่นที่เกี่ยวข้องมีประสบการทำงานด้าน Database Marketing หรือ MIS จะพิจารณาเป็นพิเศษมีทักษะ และมีความเชี่ยวชาญในภาษา เช่น Python, R และ SQLสามารถแสดงผลข้อมูลด้วยเครื่องมืออย่าง PowerBI เพื่อสื่อสารผลการวิเคราะห์ให้กับผู้บริหาร",https://ph.jobstreet.com/job/86113557?type=standard&ref=search-standalone#sol=add3aea3a6468b7b7e78796947512e3d7972f2c4
Data Analyst,Dhipaya Insurance Public Company Limited,"Yan Nawa, Bangkok, Thailand",Analysis & Reporting (Banking & Financial Services),Full time,Not specified,"Job DescriptionsAnalyzing Product performance and Seeking insight from data.Visualizing data summary to executive and other departments’ staff.Exploring new opportunities, customers, products and etc.Presenting and Communicating the summary & insight to other departments Job QualificationsEvery educational background is open.Fluent in Python coding and Microsoft Excel.Familiar with visualizing program Tableau or Power BI.Strong Logical Thinking & Reasonable Assumption setting.Having Insurance Business experience will be advantaged.Presenting & Communication skill.High responsibility and project ownership.",https://ph.jobstreet.com/job/85306428?type=standard&ref=search-standalone#sol=b9609eca04b46f112991fe133c031e7b36bb155b
Data Scientist,"Siam Commercial Bank Public Co., Ltd.","Bangkok, Thailand (Hybrid)",Developers/Programmers (Information & Communication Technology),Full time,Not specified,"Job SummaryAs Data Scientist in SCB, you will join a group of enthusiastic people working passionately to leverage this wealth of data for business uses. You will analyze the data, extract insights and create models for improving customer experience and formulating business strategies. You will work closely with multiple teams to identify opportunities and drive business results with data-driven research. Our team is constantly looking for people with strong quantitative and analytical backgrounds, who are excited about challenges at the intersection of data, math, coding, and machine learning.Job DescriptionWhat you will doApply statistical and machine learning methods to large, complex data sets to draw insights and provide actionable recommendations.Solve complex problems on both technical and business sides using advanced analytical methods.Work with Engineering teams to implement end-to-end process from model development to testing, validation, and deploymentResearch and develop new quantitative models and frameworks to enhance the company’s data science capabilityBasic QualificationsBachelor’s degree in engineering, Computer Science, Math, Physics, Statistics or other areas that are highly quantitativeExperience with statistical programming languages (e.g., Python, R, pandas) and database software (e.g., SQL, PySpark)Knowledge in statistics (e.g., hypothesis testing, regression) and machine learningStrong analytical problem-solving capabilitiesPreferred QualificationsMaster’s or PhD degree in a quantitative disciplineExperience applying machine learning and statistical methods to large datasetsSolid understanding of advanced statistics and machine learning practices.Experience in one or more specialized machine learning areas (e.g., NLP, deep learning, recommendation systems, reinforcement learning)Outstanding coding skills or software development background.Ability to think independently and communicate complex ideas to less technical personsExcellent command of English in both verbal and written forms",https://ph.jobstreet.com/job/85903012?type=standard&ref=search-standalone#sol=11e21a034a73cc32cc9aae852006700df0f0451b
Data Analyst,"S.Napa (Thailand) Co., Ltd.","Khlong Toei, Bangkok, Thailand",Database Development & Administration (Information & Communication Technology),Full time,Not specified,"Responsibilities Study, analyze, and manage databases related to strategic planning and enterprise risk management, as well as prepare summary reports and recommendations for improvements to be presented to executives or relevant departments.Study, analyze, and manage databases to support workflow improvement, audits, and the preparation of essential reports for internal organizational development.Coordinate, support, and present appropriate data collection to facilitate the development of annual planning processes across all departments. Monitor progress and compare with planned targets to ensure alignment and achievement of organizational goals.Understand internal work processes to support data collection and analysis, and prepare necessary summary reports.Oversee, coordinate, and support the development of annual KPIs with all departments and follow up on performance results.Analyze financial statement data and prepare management reports for executive presentation, including developing and expanding internal data for use in an online dashboard.Perform other duties as assigned by supervisors.QualificationsBachelor’s degree or higher in Statistics, Computer Science, Information Technology, Business Administration, Economics, or a related field.Experience 2-3 years or more in data analysis, business intelligence, or a related role.Strong analytical and problem-solving skills, with the ability to interpret complex data and translate findings into actionable insights.Proficient in data analysis tools such as Microsoft Excel (advanced level), Power BI, Tableau, or other business intelligence platforms.Knowledge of database management and querying languages, such as SQL, is a plus.Familiarity with financial data, KPI tracking, and performance dashboards.Ability to work collaboratively across departments, with strong communication and presentation skills.Detail-oriented, self-motivated, and able to manage multiple tasks and deadlines effectively.",https://ph.jobstreet.com/job/85768825?type=standard&ref=search-standalone#sol=ed8b291bf46f53bb2ad7e73ba9337d6afdc6ef7b
Business Analyst,ATA IT (National Bank of Canada Group),"Sathon, Bangkok, Thailand (Hybrid)",Business/Systems Analysts (Information & Communication Technology),Full time,Not specified,"Key Responsibilities:Work with product owners to understand the business needs, objectives, and challenges.Elicit, document, and analyze business requirements, processes, and workflows.Work with UX/UI designers, technical leads, developers, and solution architects to provide solutions aligned with business needs.Act as a bridge between business stakeholders and technical teams, ensuring clear communication and understanding of requirements, solutions, and problems.Produce and maintain detailed documentation including business requirements, process flows, use cases, and user stories.Breakdown complex requirements into actionable tasks, ensuring clarity and manageability.Manage product backlog, assist in estimation, and prioritize user stories.Collaborate with QAs to validate test plans and test results, maintaining product quality throughout the development lifecycle.Continuously refine user stories through the collaboration with the scrum team, ensuring alignment with business objectives.Qualifications:Bachelor's Degree in Computer Engineering, Business Administration, Information Technology, or related field5+ years of experience as a Business Analyst or related roleStrong analytical, problem-solving, and critical-thinking skillsExcellent communication skillsUnderstanding of software development processBanking or financial domain experience is a plusExcellent command of English What you will get from ATA IT :14 days’ vacation in first yearHealth insurance for staff & familiesLife insurance Dental fee for staff & familiesProvident fundMonetary Assistance (Childbirth, Funeral, Basket Visit)Annual PartyMonthly Activities- Staff Birthday & Company ActivitiesAnnual Health CheckMulti-national company with flexible working hours, but professional company cultureWork from Home Policy",https://ph.jobstreet.com/job/85264410?type=standard&ref=search-standalone#sol=51af02524c7a11b40a49c9bc73f717281aa69476
Business Analyst (Planning & Buget Team),Bangkok Bank Public Company Limited,"Bangkok, Thailand",Business/Systems Analysts (Information & Communication Technology),Full time,Not specified,"ติดตามสภาวะแวดล้อมในการดำเนินธุรกิจธนาคารโดยรวม วิเคราะห์ จุดแข็ง จุดอ่อน โอกาส และอุปสรรค ผลกระทบต่อธนาคาร เพื่อใช้ประกอบการกำหนด ทบทวน กลยุทธ์ แผนการดำเนินงาน เป้าหมายในภาพรวมของธนาคาร ติดตาม วิเคราะห์ผลการดำเนินงานในด้านต่างๆ รวบรวมแผนธุรกิจ และเป้าหมายการดำเนินงานของสายงาน และสรุปภาพรวมเพื่อให้สอดคล้องกับทิศทางการดำเนินธุรกิจที่ธนาคารกำหนดประสานงาน และสนับสนุนหน่วยงานต่างๆ ในการดำเนินงานให้ได้ตามแผน และเป้าหมายทางธุรกิจที่ตั้งไว้ รวบรวม และสรุปสถานะความคืบหน้าการดำเนินงานตามแผนงานเพื่อนำเสนอฝ่ายจัดการปฏิบัติงานอื่นๆ ตามที่ได้รับมอบหมาย คุณสมบัติวุฒิการศึกษาระดับปริญญาตรีหรือสูงกว่าในสาขาเศรษฐศาสตร์, การเงิน, บริหาร หรือสาขาที่เกี่ยวข้องหากมีประสบการณ์การทํางานด้าน Banking / E-Commerce หรือ Digital business 1-2 ปี จะพิจารณาเป็นพิเศษมีทักษะในการคิดวิเคราะห์เชิงตรรกะ",https://ph.jobstreet.com/job/83879439?type=standard&ref=search-standalone#sol=9ad63f95c12af84346d892f2635b18ac3955227e
Data Analyst for Finance& Accounting Department,Bangkok Bank Public Company Limited,"Yan Nawa, Bangkok, Thailand",Analysis & Reporting (Banking & Financial Services),Full time,Not specified,"ลักษณะงานพัฒนาและปรับปรุงระบบงาน เพื่อการจัดทำ Performance Report ของโครงการ MA Redesignออกแบบ และพัฒนาการจัดสรรรายได้ ค่าใช้จ่าย และเงินกองทุนให้เป็นไปตามนโยบายที่กำหนดจัดเตรียมข้อมูลการเงินและการจัดทำรายงานเพื่อการบริหารงานภายในสำหรับหน่วยงานต่าง ๆ และนำเสนอฝ่ายจัดการดูแลข้อมูลด้าน Financial Data เพื่อตรวจสอบข้อมูลการเงินให้ถูกต้องและครบถ้วนสำรับนำไปใช้ทำรายงานผลประกอบการดูแลข้อมูล Non-Financial Data เพื่อตรวจสอบข้อมูลสำหรับไปใช้เป็น Transaction Driver สำหรับการกระจายค่าใช้จ่ายวิเคราะห์ผลประกอบการในมุมมองต่าง ๆ เช่น Business Unit, Product และ Channel เป็นต้นวิเคราะห์ผลประกอบการธนาคารคู่แข่งคุณสมบัติการศึกษาระดับปริญญาตรี ขึ้นไป สาขาบริหารธุรกิจ /การเงิน การธนาคาร / สถิติ / Information Technology in Businessมีทักษะคอมพิวเตอร์ดีมาก โดยเฉพาะโปรแกรม Advanced Excel /Access / SQL/ Power BIมีทักษะในการบริหารจัดการ Database จำนวนมาก / สามารถใช้ Tools ใหม่ๆ ในการ Set up Reportมีทักษะการวิเคราะห์ / Creative ThinkingFlexible เวลาในการทำงาน และสามารถปฏิบัติงานที่สำนักพระราม 3 ได้ สถานที่ปฏิบัติงาน: ธนาคารกรุงเทพ พระราม 3 หากมีข้อสงสัยเพิ่มเติม กรุณาติดต่อ คุณพรพรรณ โทร. 063-212-0702",https://ph.jobstreet.com/job/86015292?type=standard&ref=search-standalone#sol=afd05cc8eaa0e48a499c7e08fff9d4d1455928d0
Equity Analyst,Phillip Securities (Thailand) Public Company Limited,"Bang Rak, Bangkok, Thailand",Corporate Finance & Investment Banking (Banking & Financial Services),Full time,Not specified,"Responsibilities:• Conduct comprehensive research on assigned companies, industries, and markets.• Monitor news and developments related to the assigned companies and sectors.• Assess the impact of economic and market trends on company performance.• Develop and maintain financial models to forecast future performance of companies.• Perform valuation analysis using various methods (DCF, P/E ratio, etc.).• Present findings and recommendations to clients, portfolio managers, and other stakeholders.• Collaborate with the sales team to communicate investment ideas to clients.Qualifications:• Bachelor's degree in Finance, Economics, Accounting, or a related field.• Possession of a valid Investment analyst license or holding CISA/CFA will be an advantage.• Minimum of 1-3 years of experience in equity research or a related field.• Diligent and alert.• Ability to work independently and as part of a team.• Excellent written and verbal communication skills.• English proficiency• Proficient in using financial software and tools (e.g., Bloomberg, Excel).Human Resources DepartmentTel. 02-153-9200 Ext. 6141, 6144(Only the short listed candidate will be contacted)PHILLIP SECURITIES (THAILAND) PUBLIC COMPANY LIMITED11th Floor, Vorawat Building, 849 Silom Road, Silom, Bangrak, Bangkok 10500www.phillip.co.th",https://ph.jobstreet.com/job/85380731?type=standard&ref=search-standalone#sol=69febd218cee8ac613a2a2219b4276002bad0e22
Data Analyst,Ngern Tid Lor Public Company Limited,"Phaya Thai, Bangkok, Thailand",Business/Systems Analysts (Information & Communication Technology),Full time,Not specified,"ResponsibilitiesConduct detailed analyses of business opportunities to support decision-making and strategic planning. Create comprehensive reports and dashboards with actionable insights, utilizing advanced visualization techniques.Apply basic data science methods to analyze large datasets and develop predictive models that contribute to effective decision-making and strategic initiatives.Partner closely with Business Unit and Data Engineer teams to uncover trends and insights, ensuring that initiatives are aligned with market demands and business objectives.Engage with stakeholders across the organization to gather requirements and deliver findings through clear and impactful visual, written, and verbal communication.QualificationsBachelor or Master Degree in Computer Science, Statistics, Mathematics, Business, or a related field.4+ years of experience in data analysis or a related fieldStrong analytical and problem-solving skillsExperience in the data analytics lifecycle, including problem identification, measurement/matrix, exploratory data analysis, and data insight presentation.Excellent communication and collaboration skillsProven ability to support and work effectively with cross-functional teams in a dynamic business environment.Advanced skills in SQL and Tableau are essential. Proficiency in additional tools like Python, R, Google Sheets, Google Analytics, Power BI, or similar is preferred.",https://ph.jobstreet.com/job/85777177?type=standard&ref=search-standalone#sol=99f3ab9b5d53c6ed5006e7a09bd78d024d07a192
Project manager & Business analyst,Work DD Recruitment Company Limited,"Bang Phlat, Bangkok, Thailand",Programme & Project Management (Information & Communication Technology),Contract/Temp,"฿100,000 – ฿150,000 per month (THB)","About the roleWe are seeking an experienced Project manager & Business analyst to join our team. This role combines project execution, business analysis, and service operations to support our IT initiatives and drive business success.Contract: Minimum 6 months (Renewal) Job descriptions Project Execution • Coordinate and track the progress of IT projects from planning to Go-Live. • Work closely with vendors and internal stakeholders to ensure project alignment. • Manage project timeline, milestones, deliverables, and issue escalation. • Provide regular updates to business leaders on IT performance, projects, and initiatives. • Prepare and maintain project documentation including minutes of meeting, action items, and status reports. • Support testing, training, deployment, and post-Go-Live support. • Attend monthly and weekly meetingsBusiness Analyst •  Work with users to gather, analyze, and document business requirements. • Translate business needs into system/functional specifications. • Facilitate workshops and requirement validation with business and IT teams. • Support UAT preparation, scenario creation, and issue resolution. • Identify improvement areas and propose system or process enhancements. • Support key users to review the functional specifications including application flow, business logics, screens, reports and data files, etc. • Review technical requirements, future state infrastructure and architecture to be aligned with policy.Service Operations • Monitor and support day-to-day IT service operation tasks. • Coordinate with vendors and internal users for issue resolution. • Track service requests and maintain incident records. • Ensure compliance with service-level agreements (SLAs). • Provide basic user training, knowledge transfer, and documentation. • Escalation Management in emergency cases. • Control, benchmark and optimize the IT operation.Qualifications More than 3 years of work experience in IT-related roles.Bachelor's degree in IT, Computer Science, Business Administration, or related field. Experience with Microsoft Power Platform such as Power Automate, Power BI. Hands-on experience in Microsoft Dynamics 365 configuration and administration.Ability to perform low-code development, data mapping, and workflow configuration.Familiarity with project documentation and reporting tools (e.g., Excel, PowerPoint, Project tools).Experience in managing or supporting IT projects end-to-end. Strong communication and coordination skills. Background in the automotive industry or related fields is highly advantageous. Proficient in both English and Thai (spoken, listen and written).",https://ph.jobstreet.com/job/85460655?type=standard&ref=search-standalone#sol=901920e4658e9bf02d90340e9cc51ea829d5d9d8
Incentive Management and Data Analysis (Level SO - AM),THAI CREDIT BANK PUBLIC COMPANY LIMITED,"Huai Khwang, Bangkok, Thailand",Business/Systems Analysts (Information & Communication Technology),Full time,"฿23,000 – ฿33,000 per month (THB)","Job Description: Simulate and forecast sales incentive expense according to the requirement of executive in various scenarios. Coordinate with MIS Team when incentive scheme changes are made to develop reports and dashboard accordingly including also conduct report validation (UAT) after the development is done as well. Perform incentive report validation before releasing to branches on a monthly basis, give the feedback to MIS Team in case of any error occur and correct those timely.Develop special incentive reports and submit to sales for their validation as scheduled.Advice and clarify sales’ enquiries relevant to incentive matters on day-to-day operation.Summarize and analyze incentive expense both of normal and special scheme for the executive considering.Monitor incentive expense against to OP and forecasting model including inform the executive for any issue may occur.Proceed incentive memorandums and learning materials then uploading onto the portal.Other assignment from supervisors.Job Specification: Bachelor or Master Degree of Business Management, Statistic, Mathematic or other relevant.Proven experience of end-to-end sales incentive operation at least 3 years.Excellent proficiency in Microsoft Excel to manage and analyze data effectively.Strong calculation, analytical skill, sense of numbers, logical thinking and proficiency in data analysis.Having interpersonal skill and well working as a team with colleagues, good communication skill, high responsibility and respect timeline.",https://ph.jobstreet.com/job/85543629?type=standard&ref=search-standalone#sol=005580118663e642cb72983863efff07cc389d23
